skills,interests,education_level,years_experience,certifications,projects,target_career
"node.js, databases, css, react, html, api, javascript","ui design, backend systems, frontend development, building websites",Bachelor,1,Certified,chat application,Web Developer
"system design, python, data structures, algorithms","coding, backend logic, optimizing performance, software architecture",Self-Taught,9,Certified,scalable system,Software Engineer
"sketch, adobe xd, figma, wireframing, prototyping","user interface, user testing",Bachelor,9,In Progress,mobile app design,UX Designer
"figma, adobe xd, user research","user interface, visual design",Self-Taught,1,None,website redesign,UX Designer
"css, api, javascript","building websites, frontend development",PhD,4,Certified,portfolio website,Web Developer
"deep learning, statistics, numpy","ai research, analyzing data",PhD,1,In Progress,sentiment analysis,Data Scientist
"figma, prototyping, sketch","visual design, user testing, design capability",Self-Taught,1,In Progress,mobile app design,UX Designer
"machine learning, deep learning, python, nlp, statistics, pandas, sql","analyzing data, solving complex problems",Self-Taught,6,Certified,sentiment analysis,Data Scientist
"user research, adobe xd, sketch, figma, prototyping","user interface, visual design, user testing, design capability",PhD,8,Certified,user flow diagram,UX Designer
"deep learning, python, nlp, pandas","building models, ai research",PhD,8,Certified,customer churn prediction,Data Scientist
"api, css, html, databases, javascript","ui design, frontend development, building websites",Master,0,Certified,portfolio website,Web Developer
"statistics, pandas, machine learning, nlp, python","ai research, building models, solving complex problems",Master,5,Certified,sentiment analysis,Data Scientist
"user research, sketch, prototyping","user testing, user interface, design capability",Master,2,In Progress,mobile app design,UX Designer
"algorithms, data structures, python, git, java, c++, system design","software architecture, optimizing performance, backend logic",Bachelor,6,In Progress,desktop application,Software Engineer
"figma, user research, sketch","design capability, visual design, user interface, user testing",Self-Taught,4,None,website redesign,UX Designer
"adobe xd, wireframing, figma","design capability, user interface, visual design, user testing",Bachelor,5,Certified,mobile app design,UX Designer
"algorithms, python, data structures, c++","optimizing performance, coding, backend logic",PhD,4,Certified,desktop application,Software Engineer
"communication, agile, roadmapping, analytics, scrum, market research","leading teams, product strategy, user experience, business growth",Master,4,In Progress,product launch,Product Manager
"data structures, system design, c++","coding, backend logic, optimizing performance, software architecture",Master,5,None,desktop application,Software Engineer
"data structures, algorithms, java, system design, c++","backend logic, software architecture",Bachelor,2,Certified,scalable system,Software Engineer
"machine learning, numpy, nlp, deep learning, statistics","building models, ai research, analyzing data",PhD,5,None,sentiment analysis,Data Scientist
"agile, scrum, roadmapping, communication","product strategy, user experience, leading teams, business growth",Bachelor,10,Certified,user research,Product Manager
"scrum, roadmapping, communication","leading teams, product strategy",Master,8,Certified,user research,Product Manager
"market research, roadmapping, analytics, agile, communication, scrum","leading teams, product strategy, business growth, user experience",Self-Taught,8,In Progress,product launch,Product Manager
"sketch, wireframing, user research, prototyping, adobe xd, figma","design capability, user interface, visual design",Bachelor,2,None,mobile app design,UX Designer
"adobe xd, prototyping, sketch, figma, user research, wireframing","visual design, user interface",PhD,5,In Progress,website redesign,UX Designer
"sql, python, machine learning, numpy","analyzing data, building models",Bachelor,7,Certified,customer churn prediction,Data Scientist
"analytics, roadmapping, communication, market research","business growth, leading teams, user experience, product strategy",PhD,2,Certified,product launch,Product Manager
"node.js, api, javascript, html, css, react, databases","building websites, ui design",Master,3,In Progress,chat application,Web Developer
"python, sql, machine learning, statistics, numpy, pandas","building models, ai research, analyzing data",PhD,0,In Progress,image classification,Data Scientist
"statistics, nlp, sql, machine learning","analyzing data, ai research, solving complex problems, building models",PhD,2,Certified,sentiment analysis,Data Scientist
"node.js, databases, javascript, css, react","building websites, frontend development, backend systems, ui design",Self-Taught,5,In Progress,chat application,Web Developer
"market research, roadmapping, scrum, agile, analytics","leading teams, user experience, business growth, product strategy",Bachelor,10,Certified,market analysis,Product Manager
"roadmapping, agile, market research, analytics, communication","user experience, leading teams",Bachelor,2,In Progress,market analysis,Product Manager
"javascript, node.js, react, html","ui design, backend systems",PhD,10,In Progress,chat application,Web Developer
"data structures, c++, git, java, algorithms","backend logic, coding",Master,6,In Progress,desktop application,Software Engineer
"deep learning, statistics, pandas, nlp, machine learning, numpy, sql, python","analyzing data, ai research",Self-Taught,5,In Progress,image classification,Data Scientist
"javascript, databases, node.js, react, css","backend systems, ui design, frontend development, building websites",Bachelor,8,None,portfolio website,Web Developer
"communication, analytics, market research, scrum, roadmapping","user experience, business growth",Bachelor,6,Certified,market analysis,Product Manager
"api, databases, html, react, javascript, css","backend systems, building websites",Self-Taught,8,Certified,e-commerce site,Web Developer
"sql, statistics, pandas, machine learning, nlp, python, numpy, deep learning","solving complex problems, analyzing data, ai research",PhD,8,Certified,sentiment analysis,Data Scientist
"data structures, git, java, algorithms","backend logic, optimizing performance",Master,0,None,desktop application,Software Engineer
"roadmapping, scrum, market research, agile, communication","product strategy, business growth, leading teams, user experience",Self-Taught,8,Certified,user research,Product Manager
"numpy, pandas, deep learning, statistics, machine learning, sql","analyzing data, building models",Bachelor,1,Certified,image classification,Data Scientist
"pandas, statistics, machine learning, sql, nlp, deep learning","solving complex problems, analyzing data",PhD,8,Certified,image classification,Data Scientist
"api, css, javascript","ui design, backend systems, building websites",Master,2,Certified,portfolio website,Web Developer
"react, api, css","ui design, frontend development, backend systems, building websites",Master,8,In Progress,portfolio website,Web Developer
"wireframing, sketch, figma, prototyping, adobe xd, user research","user interface, user testing",Self-Taught,5,None,mobile app design,UX Designer
"statistics, python, pandas, machine learning, numpy, nlp, deep learning","ai research, building models, solving complex problems, analyzing data",PhD,2,Certified,customer churn prediction,Data Scientist
"adobe xd, figma, wireframing, user research, sketch, prototyping","design capability, user testing, visual design",Master,8,In Progress,mobile app design,UX Designer
"machine learning, statistics, nlp, deep learning, sql, pandas, python, numpy","building models, analyzing data",PhD,10,None,sentiment analysis,Data Scientist
"market research, analytics, roadmapping, communication","leading teams, user experience, business growth",Master,6,In Progress,user research,Product Manager
"java, python, algorithms, git, system design, data structures, c++","software architecture, optimizing performance",Bachelor,10,Certified,scalable system,Software Engineer
"react, databases, node.js, javascript, css","frontend development, building websites, ui design",PhD,10,None,portfolio website,Web Developer
"c++, python, git, algorithms, system design, data structures","coding, optimizing performance",PhD,3,In Progress,scalable system,Software Engineer
"javascript, node.js, databases, css, api, react","ui design, frontend development, backend systems",Bachelor,6,None,e-commerce site,Web Developer
"communication, market research, analytics, agile, scrum","product strategy, leading teams",Bachelor,1,In Progress,user research,Product Manager
"pandas, deep learning, statistics, numpy, nlp, python, machine learning","solving complex problems, analyzing data, building models",Bachelor,3,None,customer churn prediction,Data Scientist
"pandas, machine learning, python","ai research, building models",PhD,5,None,image classification,Data Scientist
"statistics, sql, deep learning","ai research, solving complex problems",PhD,4,None,image classification,Data Scientist
"machine learning, numpy, nlp, deep learning, python","ai research, analyzing data, solving complex problems, building models",Master,1,In Progress,customer churn prediction,Data Scientist
"scrum, communication, analytics","user experience, business growth, leading teams, product strategy",Bachelor,9,In Progress,market analysis,Product Manager
"css, databases, html, api, react, javascript","frontend development, backend systems, ui design, building websites",Master,10,In Progress,e-commerce site,Web Developer
"react, databases, node.js, html","ui design, frontend development",Bachelor,0,None,chat application,Web Developer
"python, algorithms, data structures, system design, git, java","backend logic, software architecture",PhD,7,Certified,desktop application,Software Engineer
"figma, user research, sketch","design capability, user interface, visual design",Self-Taught,3,Certified,mobile app design,UX Designer
"python, system design, java, c++, git, algorithms","backend logic, software architecture, optimizing performance, coding",Self-Taught,7,None,scalable system,Software Engineer
"api, react, javascript","ui design, backend systems, frontend development",Bachelor,6,Certified,e-commerce site,Web Developer
"data structures, algorithms, c++, java","coding, backend logic, software architecture",Bachelor,10,In Progress,scalable system,Software Engineer
"css, react, databases, node.js, api, javascript, html","ui design, frontend development",Self-Taught,8,Certified,chat application,Web Developer
"pandas, deep learning, numpy, machine learning, python, nlp, sql","building models, ai research, solving complex problems",Self-Taught,9,In Progress,image classification,Data Scientist
"deep learning, statistics, machine learning, sql, pandas, python","analyzing data, ai research, solving complex problems, building models",Self-Taught,5,In Progress,sentiment analysis,Data Scientist
"market research, agile, roadmapping, analytics, scrum, communication","leading teams, business growth",Self-Taught,1,None,user research,Product Manager
"python, git, data structures, algorithms","optimizing performance, backend logic, software architecture, coding",Bachelor,1,Certified,desktop application,Software Engineer
"databases, javascript, react, node.js, css","frontend development, building websites, ui design, backend systems",Bachelor,8,In Progress,chat application,Web Developer
"api, react, node.js, databases, javascript","backend systems, ui design",Master,4,None,e-commerce site,Web Developer
"adobe xd, sketch, figma, prototyping, wireframing","design capability, user testing, visual design, user interface",Bachelor,1,Certified,mobile app design,UX Designer
"java, c++, algorithms, system design, git, python","coding, backend logic, optimizing performance",Self-Taught,0,Certified,scalable system,Software Engineer
"roadmapping, agile, market research, communication","leading teams, user experience, product strategy, business growth",Self-Taught,1,Certified,user research,Product Manager
"wireframing, adobe xd, sketch, prototyping","user interface, user testing, design capability, visual design",Bachelor,10,In Progress,website redesign,UX Designer
"roadmapping, communication, scrum","product strategy, leading teams, business growth, user experience",Self-Taught,10,In Progress,product launch,Product Manager
"c++, git, algorithms","optimizing performance, backend logic, software architecture",Self-Taught,6,In Progress,scalable system,Software Engineer
"sql, numpy, statistics, machine learning, pandas","building models, analyzing data, solving complex problems, ai research",Master,8,In Progress,customer churn prediction,Data Scientist
"numpy, deep learning, sql","analyzing data, solving complex problems",Bachelor,0,In Progress,image classification,Data Scientist
"system design, python, algorithms","software architecture, coding, backend logic, optimizing performance",Master,7,In Progress,desktop application,Software Engineer
"statistics, python, numpy, machine learning, deep learning","solving complex problems, analyzing data",PhD,6,In Progress,image classification,Data Scientist
"scrum, agile, communication, roadmapping, analytics, market research","leading teams, business growth",Self-Taught,5,In Progress,market analysis,Product Manager
"data structures, java, algorithms, git, system design, c++, python","backend logic, software architecture, optimizing performance",PhD,6,In Progress,scalable system,Software Engineer
"communication, roadmapping, agile, market research","user experience, leading teams, business growth, product strategy",PhD,6,Certified,product launch,Product Manager
"nlp, deep learning, pandas, sql","solving complex problems, ai research, analyzing data",Master,2,None,customer churn prediction,Data Scientist
"css, react, javascript","building websites, backend systems, frontend development",Bachelor,5,None,portfolio website,Web Developer
"node.js, react, api, css, html, javascript","ui design, backend systems, building websites",Bachelor,9,Certified,chat application,Web Developer
"css, react, html","backend systems, ui design",Self-Taught,8,Certified,chat application,Web Developer
"user research, wireframing, adobe xd, figma, prototyping, sketch","design capability, user interface, user testing, visual design",Master,10,In Progress,mobile app design,UX Designer
"adobe xd, wireframing, prototyping","user testing, user interface, design capability",Master,9,Certified,mobile app design,UX Designer
"wireframing, figma, prototyping, adobe xd, sketch, user research","user interface, visual design",Self-Taught,10,In Progress,website redesign,UX Designer
"numpy, python, pandas","building models, analyzing data, ai research",Master,8,Certified,customer churn prediction,Data Scientist
"nlp, deep learning, pandas, python, statistics, sql, numpy","ai research, analyzing data, building models",Bachelor,4,None,image classification,Data Scientist
"sketch, user research, adobe xd, figma, prototyping","user interface, design capability, visual design",Master,10,Certified,mobile app design,UX Designer
"python, nlp, pandas, sql","ai research, building models, analyzing data, solving complex problems",Self-Taught,3,In Progress,sentiment analysis,Data Scientist
"user research, prototyping, adobe xd","user interface, design capability, visual design",Bachelor,0,Certified,user flow diagram,UX Designer
"html, api, node.js, react","frontend development, building websites, backend systems",Bachelor,0,Certified,portfolio website,Web Developer
"statistics, pandas, sql, python, numpy","solving complex problems, ai research, building models",PhD,1,None,image classification,Data Scientist
"pandas, sql, nlp, statistics, machine learning","solving complex problems, building models",Self-Taught,9,In Progress,sentiment analysis,Data Scientist
"agile, market research, communication","business growth, user experience, leading teams, product strategy",Self-Taught,8,In Progress,market analysis,Product Manager
"css, api, node.js, javascript","frontend development, ui design",PhD,2,In Progress,e-commerce site,Web Developer
"system design, git, python","software architecture, optimizing performance",PhD,4,None,scalable system,Software Engineer
"communication, agile, analytics, roadmapping","business growth, user experience, leading teams",Master,0,Certified,user research,Product Manager
"css, databases, javascript, node.js, html, api","frontend development, building websites",Self-Taught,2,Certified,portfolio website,Web Developer
"python, nlp, numpy, deep learning, pandas, sql","analyzing data, building models, ai research, solving complex problems",Self-Taught,1,None,image classification,Data Scientist
"css, react, javascript, databases, api","ui design, building websites, frontend development",PhD,8,In Progress,e-commerce site,Web Developer
"css, javascript, node.js, databases, api, html","ui design, building websites, backend systems, frontend development",Bachelor,10,In Progress,chat application,Web Developer
"scrum, market research, agile","user experience, business growth, product strategy",Bachelor,1,None,market analysis,Product Manager
"java, git, system design, c++","backend logic, coding, optimizing performance, software architecture",Master,7,None,algorithm visualizer,Software Engineer
"machine learning, sql, pandas","solving complex problems, analyzing data",Bachelor,8,None,sentiment analysis,Data Scientist
"prototyping, user research, figma, adobe xd, wireframing, sketch","visual design, user testing",PhD,5,Certified,mobile app design,UX Designer
"roadmapping, communication, market research","leading teams, business growth, product strategy",PhD,0,None,product launch,Product Manager
"roadmapping, market research, analytics","user experience, leading teams, business growth, product strategy",Self-Taught,7,Certified,market analysis,Product Manager
"adobe xd, wireframing, sketch, user research","design capability, visual design, user interface, user testing",Master,10,None,website redesign,UX Designer
"numpy, python, machine learning, nlp, sql, pandas, statistics, deep learning","solving complex problems, building models, ai research, analyzing data",Master,1,In Progress,image classification,Data Scientist
"javascript, html, databases","ui design, building websites, backend systems",PhD,2,None,portfolio website,Web Developer
"agile, scrum, analytics, communication, roadmapping","user experience, business growth",Self-Taught,4,Certified,user research,Product Manager
"data structures, git, system design, java, algorithms, c++, python","software architecture, coding, optimizing performance, backend logic",Self-Taught,4,In Progress,scalable system,Software Engineer
"html, node.js, javascript, react, css","frontend development, backend systems, ui design, building websites",Self-Taught,7,None,portfolio website,Web Developer
"java, c++, git","optimizing performance, software architecture, coding",Master,4,In Progress,scalable system,Software Engineer
"statistics, python, machine learning, pandas, numpy, nlp, sql, deep learning","ai research, analyzing data",Self-Taught,2,Certified,image classification,Data Scientist
"html, css, javascript, databases, react, api, node.js","building websites, frontend development",Bachelor,1,In Progress,chat application,Web Developer
"python, numpy, machine learning, sql, deep learning","analyzing data, building models, solving complex problems, ai research",Bachelor,3,Certified,customer churn prediction,Data Scientist
"pandas, sql, nlp, numpy, machine learning, deep learning, python","building models, analyzing data, solving complex problems, ai research",PhD,4,In Progress,sentiment analysis,Data Scientist
"analytics, communication, agile, scrum, market research","product strategy, business growth, leading teams",PhD,0,None,market analysis,Product Manager
"api, node.js, react, html","frontend development, backend systems, ui design, building websites",Bachelor,7,None,chat application,Web Developer
"communication, scrum, market research","leading teams, product strategy, business growth",Master,9,None,product launch,Product Manager
"statistics, nlp, python, numpy, sql, machine learning, pandas","building models, analyzing data",Master,5,None,sentiment analysis,Data Scientist
"figma, wireframing, user research, adobe xd, sketch, prototyping","visual design, user interface, user testing",Bachelor,5,Certified,user flow diagram,UX Designer
"api, html, databases, react, javascript, css","ui design, frontend development, backend systems, building websites",PhD,6,Certified,portfolio website,Web Developer
"api, javascript, html, react","frontend development, building websites, backend systems, ui design",Master,7,In Progress,chat application,Web Developer
"databases, html, node.js, api, javascript","building websites, frontend development, ui design, backend systems",Master,8,None,portfolio website,Web Developer
"statistics, numpy, python, sql, nlp, pandas","analyzing data, building models, solving complex problems",PhD,0,Certified,image classification,Data Scientist
"python, deep learning, statistics, machine learning, sql","analyzing data, ai research, building models, solving complex problems",PhD,4,In Progress,sentiment analysis,Data Scientist
"java, system design, algorithms","backend logic, coding, optimizing performance, software architecture",Self-Taught,2,Certified,algorithm visualizer,Software Engineer
"nlp, machine learning, python, deep learning, sql, numpy","building models, solving complex problems, ai research",Self-Taught,6,None,customer churn prediction,Data Scientist
"user research, wireframing, adobe xd, sketch, prototyping, figma","visual design, user interface, design capability",Self-Taught,10,In Progress,website redesign,UX Designer
"machine learning, nlp, pandas, numpy, deep learning","building models, ai research, solving complex problems, analyzing data",Self-Taught,7,In Progress,image classification,Data Scientist
"python, sql, nlp, machine learning, pandas, statistics","analyzing data, ai research, solving complex problems",Self-Taught,6,Certified,sentiment analysis,Data Scientist
"analytics, agile, market research","business growth, product strategy",PhD,7,None,market analysis,Product Manager
"javascript, html, api, css, databases","ui design, building websites, backend systems",Master,8,In Progress,e-commerce site,Web Developer
"pandas, statistics, machine learning, python, deep learning, numpy, sql","analyzing data, solving complex problems",Bachelor,10,None,customer churn prediction,Data Scientist
"react, api, html, javascript, css, node.js, databases","backend systems, frontend development, building websites, ui design",Self-Taught,4,None,portfolio website,Web Developer
"css, node.js, html, react, api","backend systems, ui design, frontend development, building websites",Master,6,In Progress,portfolio website,Web Developer
"databases, node.js, javascript, react, html","backend systems, frontend development, building websites",Bachelor,3,None,portfolio website,Web Developer
"javascript, databases, react, css, api, html","building websites, backend systems",PhD,3,None,chat application,Web Developer
"python, data structures, algorithms, git, java","backend logic, software architecture",Self-Taught,3,None,algorithm visualizer,Software Engineer
"data structures, python, algorithms, c++, java, system design, git","coding, software architecture",Bachelor,0,None,scalable system,Software Engineer
"javascript, node.js, css, databases, api, html","building websites, frontend development, ui design, backend systems",Bachelor,9,In Progress,chat application,Web Developer
"statistics, pandas, machine learning, deep learning","ai research, solving complex problems, building models",Bachelor,5,Certified,image classification,Data Scientist
"css, javascript, html, react","backend systems, frontend development, building websites",Master,0,None,e-commerce site,Web Developer
"adobe xd, prototyping, user research","user testing, user interface, design capability",Bachelor,1,None,website redesign,UX Designer
"javascript, databases, html","frontend development, building websites, backend systems",PhD,5,In Progress,e-commerce site,Web Developer
"communication, scrum, roadmapping, agile, market research, analytics","user experience, product strategy, business growth",Master,3,In Progress,product launch,Product Manager
"analytics, roadmapping, agile","product strategy, leading teams, user experience",Master,3,Certified,market analysis,Product Manager
"prototyping, user research, wireframing, adobe xd, figma","visual design, user testing",PhD,3,None,website redesign,UX Designer
"numpy, machine learning, nlp, deep learning","solving complex problems, analyzing data",Bachelor,9,Certified,image classification,Data Scientist
"statistics, sql, pandas, deep learning","ai research, building models, solving complex problems",Bachelor,0,In Progress,sentiment analysis,Data Scientist
"sketch, figma, prototyping","visual design, design capability",Bachelor,5,In Progress,mobile app design,UX Designer
"market research, scrum, analytics, roadmapping","product strategy, user experience, business growth",Bachelor,4,None,market analysis,Product Manager
"roadmapping, scrum, agile, analytics, market research, communication","user experience, product strategy",Master,0,In Progress,market analysis,Product Manager
"statistics, python, nlp","solving complex problems, ai research, building models",Master,5,In Progress,customer churn prediction,Data Scientist
"analytics, market research, communication","leading teams, user experience, business growth",Bachelor,8,None,user research,Product Manager
