skills,interests,education_level,years_experience,certifications,projects,target_career
"html, node.js, databases","backend systems, frontend development, ui design",Self-Taught,3,Certified,portfolio website,Web Developer
"python, git, java, data structures, algorithms, system design","coding, software architecture",PhD,3,None,algorithm visualizer,Software Engineer
"html, javascript, css, api","building websites, ui design, backend systems",Master,6,Certified,e-commerce site,Web Developer
"css, javascript, node.js, react, api","frontend development, backend systems, building websites",Bachelor,0,In Progress,e-commerce site,Web Developer
"css, node.js, react, html, javascript","frontend development, building websites, backend systems, ui design",Self-Taught,10,In Progress,portfolio website,Web Developer
"figma, wireframing, user research","user testing, design capability, visual design, user interface",Master,10,Certified,mobile app design,UX Designer
"sketch, wireframing, adobe xd, figma, user research, prototyping","user interface, user testing",Bachelor,3,In Progress,user flow diagram,UX Designer
"adobe xd, prototyping, sketch, wireframing, user research, figma","visual design, design capability, user interface",PhD,7,Certified,mobile app design,UX Designer
"html, react, node.js, javascript, databases","backend systems, building websites, ui design",Bachelor,6,Certified,portfolio website,Web Developer
"css, javascript, react","backend systems, frontend development, building websites, ui design",PhD,3,In Progress,chat application,Web Developer
"figma, prototyping, sketch","user testing, design capability",Self-Taught,4,In Progress,website redesign,UX Designer
"sql, python, nlp, pandas, statistics, numpy, machine learning","building models, solving complex problems",PhD,9,None,customer churn prediction,Data Scientist
"wireframing, figma, prototyping","design capability, user testing, visual design, user interface",PhD,8,Certified,user flow diagram,UX Designer
"python, pandas, statistics, nlp, machine learning, deep learning, numpy, sql","ai research, analyzing data, building models, solving complex problems",Self-Taught,4,Certified,customer churn prediction,Data Scientist
"agile, analytics, communication, market research","leading teams, product strategy, user experience",Self-Taught,5,Certified,market analysis,Product Manager
"deep learning, machine learning, nlp, statistics, numpy, pandas, sql, python","building models, solving complex problems, ai research",PhD,5,In Progress,image classification,Data Scientist
"c++, git, system design, java","backend logic, coding, optimizing performance",Self-Taught,6,In Progress,algorithm visualizer,Software Engineer
"git, python, algorithms, java, c++, system design","software architecture, optimizing performance",Self-Taught,4,Certified,desktop application,Software Engineer
"wireframing, figma, adobe xd, user research, prototyping","user testing, design capability",Self-Taught,5,Certified,mobile app design,UX Designer
"api, react, javascript, html, databases, css","backend systems, building websites",PhD,1,None,chat application,Web Developer
"prototyping, sketch, adobe xd","user interface, design capability, visual design, user testing",Master,4,None,mobile app design,UX Designer
"adobe xd, wireframing, sketch, figma","visual design, design capability",Master,1,None,mobile app design,UX Designer
"roadmapping, communication, agile","user experience, product strategy",Master,5,None,user research,Product Manager
"c++, java, python, git, algorithms, data structures","backend logic, software architecture, optimizing performance, coding",Self-Taught,10,In Progress,desktop application,Software Engineer
"data structures, git, c++, python, java, system design, algorithms","backend logic, software architecture, coding, optimizing performance",Master,9,In Progress,algorithm visualizer,Software Engineer
"python, deep learning, numpy, statistics","solving complex problems, ai research, building models, analyzing data",Self-Taught,6,None,image classification,Data Scientist
"git, python, system design","backend logic, coding, software architecture",Self-Taught,8,Certified,algorithm visualizer,Software Engineer
"api, databases, html, javascript, css","backend systems, frontend development, ui design, building websites",Master,7,None,portfolio website,Web Developer
"prototyping, user research, sketch, figma","visual design, user testing, user interface",Bachelor,2,In Progress,website redesign,UX Designer
"communication, scrum, market research, analytics, roadmapping, agile","user experience, leading teams, business growth",PhD,6,In Progress,market analysis,Product Manager
"css, api, react, databases","building websites, ui design",Master,7,In Progress,e-commerce site,Web Developer
"agile, market research, roadmapping, scrum, communication, analytics","user experience, business growth, leading teams",Bachelor,1,None,product launch,Product Manager
"pandas, deep learning, machine learning, python, sql, nlp","building models, ai research",Bachelor,8,In Progress,image classification,Data Scientist
"user research, adobe xd, sketch, figma, prototyping","design capability, user interface, visual design, user testing",Bachelor,8,In Progress,website redesign,UX Designer
"api, databases, react","ui design, backend systems, building websites",Self-Taught,1,In Progress,e-commerce site,Web Developer
"agile, scrum, roadmapping, market research","business growth, user experience",PhD,0,In Progress,product launch,Product Manager
"analytics, scrum, communication, agile","product strategy, user experience, business growth",Self-Taught,0,In Progress,user research,Product Manager
"user research, wireframing, adobe xd","visual design, user interface",Self-Taught,4,None,mobile app design,UX Designer
"node.js, javascript, html, api, databases, css, react","backend systems, building websites, ui design",Self-Taught,4,None,portfolio website,Web Developer
"html, javascript, api, node.js, react, databases","building websites, ui design",Bachelor,1,None,portfolio website,Web Developer
"api, css, html, databases, javascript","frontend development, building websites, backend systems",Master,10,None,portfolio website,Web Developer
"sketch, adobe xd, prototyping","visual design, user testing",Bachelor,1,None,website redesign,UX Designer
"communication, roadmapping, scrum, analytics, market research","business growth, product strategy, leading teams, user experience",Bachelor,2,In Progress,product launch,Product Manager
"css, javascript, react, databases, node.js","ui design, building websites",Self-Taught,6,None,e-commerce site,Web Developer
"python, system design, java","optimizing performance, coding",Master,5,In Progress,algorithm visualizer,Software Engineer
"git, java, algorithms, c++, system design","backend logic, coding",Bachelor,4,Certified,algorithm visualizer,Software Engineer
"wireframing, sketch, prototyping, adobe xd, figma","user testing, user interface, design capability",Bachelor,4,In Progress,website redesign,UX Designer
"git, data structures, java, c++","optimizing performance, backend logic, coding, software architecture",Bachelor,0,None,desktop application,Software Engineer
"market research, roadmapping, communication, scrum","product strategy, leading teams, business growth, user experience",Bachelor,2,Certified,user research,Product Manager
"java, python, algorithms","optimizing performance, coding, software architecture",Master,8,None,scalable system,Software Engineer
"css, javascript, node.js","frontend development, building websites",PhD,8,None,portfolio website,Web Developer
"analytics, roadmapping, scrum, agile, market research","product strategy, leading teams, business growth",PhD,9,Certified,product launch,Product Manager
"machine learning, statistics, nlp, deep learning, pandas, numpy, sql, python","building models, analyzing data",PhD,6,Certified,sentiment analysis,Data Scientist
"adobe xd, user research, sketch, wireframing, figma, prototyping","user testing, user interface, visual design",Self-Taught,10,Certified,website redesign,UX Designer
"prototyping, figma, user research, wireframing, adobe xd, sketch","visual design, design capability, user interface",Master,3,Certified,website redesign,UX Designer
"sql, nlp, pandas","solving complex problems, building models",PhD,0,In Progress,sentiment analysis,Data Scientist
"pandas, deep learning, nlp, sql, numpy, python, statistics","ai research, solving complex problems",Master,0,None,image classification,Data Scientist
"communication, scrum, market research, analytics, roadmapping","leading teams, user experience",PhD,5,None,user research,Product Manager
"adobe xd, figma, prototyping","visual design, user testing, design capability, user interface",Master,5,In Progress,website redesign,UX Designer
"databases, html, node.js, api","backend systems, frontend development",Self-Taught,4,In Progress,chat application,Web Developer
"wireframing, prototyping, figma, sketch, adobe xd","user testing, user interface, design capability, visual design",Self-Taught,1,Certified,website redesign,UX Designer
"nlp, pandas, python","solving complex problems, building models",Master,8,Certified,customer churn prediction,Data Scientist
"analytics, communication, scrum, market research","business growth, leading teams",Bachelor,9,In Progress,product launch,Product Manager
"agile, market research, roadmapping","leading teams, product strategy, user experience",Self-Taught,8,Certified,product launch,Product Manager
"wireframing, prototyping, adobe xd, user research, sketch","design capability, user interface, visual design",Master,10,None,user flow diagram,UX Designer
"node.js, html, react, javascript, css","backend systems, building websites, frontend development, ui design",PhD,3,In Progress,e-commerce site,Web Developer
"sql, deep learning, machine learning, python","building models, analyzing data",PhD,7,In Progress,customer churn prediction,Data Scientist
"data structures, java, algorithms, python, c++, system design","backend logic, coding",Master,1,None,scalable system,Software Engineer
"java, python, data structures, git, c++","software architecture, backend logic",Master,4,Certified,desktop application,Software Engineer
"python, c++, system design","software architecture, coding, optimizing performance, backend logic",PhD,1,None,desktop application,Software Engineer
"communication, scrum, agile, roadmapping, market research","user experience, product strategy, leading teams, business growth",Bachelor,6,In Progress,user research,Product Manager
"system design, git, algorithms","optimizing performance, coding, software architecture, backend logic",PhD,10,None,algorithm visualizer,Software Engineer
"market research, agile, roadmapping, scrum, communication","user experience, business growth, leading teams, product strategy",Master,4,Certified,user research,Product Manager
"user research, wireframing, sketch, adobe xd, figma","user interface, design capability, visual design",PhD,0,Certified,mobile app design,UX Designer
"analytics, communication, roadmapping, market research","user experience, business growth",Self-Taught,1,None,market analysis,Product Manager
"nlp, deep learning, pandas, statistics, numpy, sql","building models, solving complex problems",Bachelor,4,None,image classification,Data Scientist
"sketch, adobe xd, figma, user research","user interface, design capability",Self-Taught,8,Certified,website redesign,UX Designer
"wireframing, figma, prototyping, user research, adobe xd, sketch","user interface, visual design, design capability",PhD,4,None,website redesign,UX Designer
"data structures, git, java, system design, c++, algorithms, python","backend logic, software architecture, optimizing performance",PhD,0,Certified,algorithm visualizer,Software Engineer
"market research, analytics, scrum, communication","business growth, user experience, product strategy",Master,0,In Progress,user research,Product Manager
"market research, agile, roadmapping, communication","business growth, product strategy, user experience, leading teams",Self-Taught,9,In Progress,user research,Product Manager
"wireframing, prototyping, sketch, adobe xd, user research, figma","user interface, visual design, design capability",PhD,2,In Progress,user flow diagram,UX Designer
"scrum, market research, analytics, communication, roadmapping, agile","leading teams, business growth, product strategy, user experience",Self-Taught,6,Certified,user research,Product Manager
"statistics, numpy, deep learning","solving complex problems, ai research, building models, analyzing data",Bachelor,10,Certified,image classification,Data Scientist
"algorithms, git, data structures, system design, python, java, c++","backend logic, software architecture, coding, optimizing performance",Master,5,None,algorithm visualizer,Software Engineer
"figma, adobe xd, user research, sketch","user testing, design capability, user interface",PhD,0,Certified,website redesign,UX Designer
"python, git, c++, java, algorithms, system design","coding, backend logic, software architecture, optimizing performance",Self-Taught,7,None,scalable system,Software Engineer
"pandas, nlp, numpy, python","building models, analyzing data",Master,1,In Progress,customer churn prediction,Data Scientist
"machine learning, pandas, nlp, python","ai research, building models, solving complex problems",Self-Taught,7,None,customer churn prediction,Data Scientist
"pandas, machine learning, python, nlp, deep learning","solving complex problems, ai research, building models",Bachelor,0,In Progress,customer churn prediction,Data Scientist
"node.js, api, html, javascript, css","ui design, frontend development",Master,8,Certified,e-commerce site,Web Developer
"node.js, api, javascript, react","building websites, frontend development, ui design",Master,10,Certified,portfolio website,Web Developer
"nlp, machine learning, numpy, statistics, python, pandas, deep learning, sql","building models, ai research",Bachelor,1,None,sentiment analysis,Data Scientist
"python, c++, data structures","software architecture, optimizing performance",PhD,9,In Progress,desktop application,Software Engineer
"statistics, numpy, deep learning, pandas, python, sql","ai research, solving complex problems",PhD,0,None,customer churn prediction,Data Scientist
"nlp, sql, pandas, deep learning, statistics, machine learning","solving complex problems, ai research, building models",Bachelor,9,In Progress,customer churn prediction,Data Scientist
"agile, scrum, market research","product strategy, leading teams, business growth",Self-Taught,7,Certified,product launch,Product Manager
"deep learning, machine learning, nlp, pandas","analyzing data, solving complex problems, building models",Self-Taught,2,None,image classification,Data Scientist
"css, databases, node.js, html, javascript","ui design, backend systems",Self-Taught,9,In Progress,chat application,Web Developer
"api, react, javascript, css","backend systems, frontend development, ui design",Master,4,None,chat application,Web Developer
"data structures, git, system design, java","coding, optimizing performance, backend logic",Bachelor,8,Certified,desktop application,Software Engineer
"nlp, numpy, pandas, sql","solving complex problems, ai research",Master,8,None,customer churn prediction,Data Scientist
"data structures, python, algorithms","backend logic, coding, optimizing performance",Bachelor,10,In Progress,algorithm visualizer,Software Engineer
"git, data structures, system design, java, algorithms, python, c++","optimizing performance, backend logic, software architecture",Bachelor,5,None,scalable system,Software Engineer
"user research, figma, wireframing, adobe xd, prototyping","visual design, user testing, design capability",Self-Taught,6,In Progress,website redesign,UX Designer
"analytics, scrum, market research","user experience, leading teams, business growth, product strategy",PhD,0,None,market analysis,Product Manager
"statistics, machine learning, nlp, sql, python, deep learning, numpy","ai research, analyzing data",PhD,2,In Progress,customer churn prediction,Data Scientist
"prototyping, wireframing, figma, user research","user interface, visual design",Master,9,In Progress,website redesign,UX Designer
"adobe xd, prototyping, user research, sketch, wireframing","design capability, user interface, user testing",Self-Taught,4,Certified,user flow diagram,UX Designer
"user research, figma, adobe xd, sketch","user testing, user interface, visual design",PhD,9,In Progress,user flow diagram,UX Designer
"databases, javascript, api, css, react, node.js","frontend development, ui design",Master,10,Certified,chat application,Web Developer
"python, nlp, deep learning, sql, pandas, numpy, machine learning","building models, analyzing data",Self-Taught,9,In Progress,image classification,Data Scientist
"wireframing, prototyping, sketch, adobe xd, figma","user interface, design capability, user testing, visual design",Self-Taught,5,In Progress,mobile app design,UX Designer
"analytics, agile, market research, scrum, roadmapping","user experience, product strategy",Bachelor,10,Certified,market analysis,Product Manager
"agile, roadmapping, scrum, market research, communication, analytics","leading teams, product strategy",Master,4,Certified,market analysis,Product Manager
"python, numpy, machine learning, nlp, sql, deep learning, pandas","ai research, solving complex problems, analyzing data",PhD,1,Certified,image classification,Data Scientist
"algorithms, python, git, data structures","backend logic, coding, optimizing performance",PhD,0,In Progress,algorithm visualizer,Software Engineer
"agile, scrum, roadmapping, analytics","user experience, business growth, product strategy, leading teams",PhD,9,None,user research,Product Manager
"user research, prototyping, figma","design capability, user testing, visual design",PhD,9,Certified,user flow diagram,UX Designer
"api, javascript, databases","frontend development, ui design, building websites",Self-Taught,10,Certified,chat application,Web Developer
"c++, data structures, git, algorithms","backend logic, coding, software architecture, optimizing performance",Bachelor,4,Certified,algorithm visualizer,Software Engineer
"figma, sketch, prototyping, user research","user testing, design capability, visual design",Self-Taught,3,Certified,website redesign,UX Designer
"prototyping, adobe xd, wireframing, user research, figma","user testing, visual design, user interface, design capability",Self-Taught,2,Certified,user flow diagram,UX Designer
"nlp, numpy, python, machine learning, pandas","analyzing data, ai research, building models, solving complex problems",Bachelor,9,In Progress,customer churn prediction,Data Scientist
"css, javascript, node.js, react, api","frontend development, backend systems, ui design, building websites",Bachelor,0,None,portfolio website,Web Developer
"adobe xd, prototyping, wireframing, user research, sketch, figma","user interface, visual design, design capability, user testing",Self-Taught,7,In Progress,mobile app design,UX Designer
"python, sql, machine learning, deep learning, numpy, statistics, nlp, pandas","analyzing data, solving complex problems, building models",Master,9,In Progress,image classification,Data Scientist
"user research, wireframing, figma, adobe xd, sketch","design capability, visual design, user testing",Self-Taught,4,Certified,mobile app design,UX Designer
"algorithms, c++, python, system design, git, data structures, java","backend logic, optimizing performance, coding",Master,6,Certified,scalable system,Software Engineer
"deep learning, nlp, python, pandas, numpy, sql, statistics, machine learning","building models, ai research",Master,4,Certified,sentiment analysis,Data Scientist
"agile, analytics, scrum, market research, roadmapping, communication","user experience, product strategy",Bachelor,4,None,product launch,Product Manager
"nlp, numpy, deep learning","building models, ai research, analyzing data",PhD,2,Certified,image classification,Data Scientist
"communication, scrum, roadmapping, analytics, agile, market research","business growth, product strategy, user experience, leading teams",Master,3,Certified,user research,Product Manager
"market research, scrum, analytics, roadmapping","business growth, user experience",Master,3,None,product launch,Product Manager
"adobe xd, prototyping, wireframing, figma","user interface, design capability, user testing, visual design",Master,1,None,website redesign,UX Designer
"python, algorithms, data structures, java, system design","optimizing performance, backend logic",Bachelor,7,None,algorithm visualizer,Software Engineer
"html, javascript, css, react, node.js, api","building websites, backend systems",Bachelor,2,None,e-commerce site,Web Developer
"algorithms, java, c++, python, data structures","optimizing performance, coding",PhD,2,None,desktop application,Software Engineer
"prototyping, figma, sketch","design capability, visual design",PhD,0,In Progress,website redesign,UX Designer
"wireframing, sketch, figma, user research, prototyping","user interface, design capability",Bachelor,3,None,user flow diagram,UX Designer
"adobe xd, prototyping, user research, wireframing","visual design, user interface, design capability, user testing",Self-Taught,4,Certified,website redesign,UX Designer
"sql, machine learning, pandas, statistics, deep learning, nlp, python, numpy","analyzing data, ai research, solving complex problems",Master,9,In Progress,customer churn prediction,Data Scientist
"java, python, git","software architecture, backend logic, coding, optimizing performance",PhD,7,None,scalable system,Software Engineer
"sql, machine learning, deep learning, numpy, nlp, statistics, pandas","ai research, analyzing data, building models",Bachelor,2,In Progress,customer churn prediction,Data Scientist
"sketch, adobe xd, user research, figma, prototyping, wireframing","user testing, design capability, user interface, visual design",Self-Taught,6,None,user flow diagram,UX Designer
"market research, roadmapping, agile, analytics, scrum","leading teams, business growth",Master,6,Certified,product launch,Product Manager
"wireframing, adobe xd, prototyping, user research","user interface, design capability",Self-Taught,9,In Progress,website redesign,UX Designer
"c++, java, data structures, algorithms, system design, git","coding, optimizing performance",PhD,6,In Progress,desktop application,Software Engineer
"adobe xd, prototyping, wireframing","design capability, visual design",Self-Taught,10,In Progress,user flow diagram,UX Designer
"sql, deep learning, numpy, python, machine learning","ai research, analyzing data, building models",Self-Taught,9,Certified,customer churn prediction,Data Scientist
"roadmapping, market research, analytics, scrum","user experience, leading teams, business growth",Self-Taught,3,None,user research,Product Manager
"nlp, pandas, sql, numpy, machine learning, python, statistics, deep learning","solving complex problems, analyzing data, ai research",Master,2,Certified,customer churn prediction,Data Scientist
"adobe xd, wireframing, prototyping","design capability, user interface, visual design, user testing",Self-Taught,8,Certified,mobile app design,UX Designer
"react, html, javascript, node.js","frontend development, backend systems",Self-Taught,9,None,chat application,Web Developer
"node.js, react, databases, api, javascript, css, html","frontend development, backend systems, building websites",Master,1,None,chat application,Web Developer
"databases, javascript, react, node.js, css, api, html","ui design, frontend development, backend systems, building websites",Master,3,In Progress,chat application,Web Developer
"python, nlp, numpy","ai research, analyzing data, solving complex problems",Master,2,In Progress,sentiment analysis,Data Scientist
"roadmapping, agile, scrum, market research, communication, analytics","product strategy, business growth",Master,9,In Progress,user research,Product Manager
"react, node.js, api, databases","frontend development, ui design, building websites, backend systems",Master,6,In Progress,e-commerce site,Web Developer
"wireframing, prototyping, user research, adobe xd","visual design, design capability, user testing, user interface",Bachelor,10,In Progress,website redesign,UX Designer
"sketch, figma, adobe xd, wireframing","visual design, user testing, user interface, design capability",PhD,6,Certified,website redesign,UX Designer
"python, statistics, pandas, nlp, deep learning, machine learning","analyzing data, building models, ai research, solving complex problems",Master,4,Certified,sentiment analysis,Data Scientist
"wireframing, prototyping, sketch, adobe xd","design capability, visual design",Self-Taught,4,Certified,user flow diagram,UX Designer
"numpy, nlp, statistics, deep learning","ai research, analyzing data",Bachelor,7,None,sentiment analysis,Data Scientist
"wireframing, figma, sketch","visual design, design capability, user testing",PhD,6,None,website redesign,UX Designer
"git, data structures, system design, algorithms","optimizing performance, software architecture, coding, backend logic",Bachelor,3,None,scalable system,Software Engineer
"node.js, databases, react","ui design, frontend development, building websites",Bachelor,8,Certified,portfolio website,Web Developer
"scrum, market research, communication","user experience, leading teams, product strategy",Bachelor,3,Certified,market analysis,Product Manager
"communication, scrum, agile, roadmapping, market research, analytics","business growth, product strategy",PhD,7,None,product launch,Product Manager
"numpy, sql, nlp","building models, ai research",Self-Taught,1,Certified,sentiment analysis,Data Scientist
"analytics, agile, scrum, roadmapping","leading teams, user experience",Master,7,In Progress,market analysis,Product Manager
