skills,interests,education_level,years_experience,certifications,projects,target_career
"user research, adobe xd, prototyping, sketch, wireframing","visual design, design capability, user interface, user testing",Master,4,None,user flow diagram,UX Designer
"sql, machine learning, deep learning","analyzing data, building models, solving complex problems, ai research",Master,6,None,customer churn prediction,Data Scientist
"java, git, system design","coding, backend logic, software architecture, optimizing performance",Bachelor,10,In Progress,scalable system,Software Engineer
"prototyping, figma, adobe xd","user interface, visual design, design capability, user testing",Self-Taught,0,In Progress,website redesign,UX Designer
"python, system design, algorithms, c++, java","coding, backend logic, optimizing performance, software architecture",PhD,5,None,desktop application,Software Engineer
"c++, algorithms, java, python","backend logic, optimizing performance",Bachelor,1,None,scalable system,Software Engineer
"machine learning, statistics, sql, numpy, pandas, nlp, deep learning, python","ai research, analyzing data",PhD,10,None,image classification,Data Scientist
"nlp, python, pandas, deep learning, sql","analyzing data, building models",Master,8,In Progress,sentiment analysis,Data Scientist
"javascript, api, react, databases, css, node.js","frontend development, ui design",PhD,3,None,e-commerce site,Web Developer
"python, system design, git, algorithms, java, c++, data structures","optimizing performance, software architecture, backend logic",PhD,10,None,scalable system,Software Engineer
"javascript, react, css, api, node.js, html, databases","frontend development, building websites, backend systems",Bachelor,9,None,portfolio website,Web Developer
"html, javascript, databases, api, css, node.js, react","frontend development, building websites, ui design",Bachelor,8,In Progress,e-commerce site,Web Developer
"agile, scrum, analytics, roadmapping, market research, communication","user experience, leading teams",Bachelor,0,In Progress,product launch,Product Manager
"html, node.js, react","backend systems, building websites, ui design",Bachelor,8,In Progress,e-commerce site,Web Developer
"statistics, sql, pandas","ai research, solving complex problems, analyzing data, building models",Self-Taught,10,Certified,sentiment analysis,Data Scientist
"databases, api, css, node.js, html, javascript","ui design, frontend development, backend systems",Bachelor,2,In Progress,chat application,Web Developer
"html, css, databases, javascript","building websites, frontend development, ui design",Master,6,Certified,chat application,Web Developer
"html, api, node.js, react","backend systems, ui design, building websites, frontend development",PhD,9,None,portfolio website,Web Developer
"scrum, communication, market research, analytics, roadmapping","user experience, leading teams, business growth",PhD,0,In Progress,user research,Product Manager
"scrum, analytics, agile","leading teams, business growth, user experience",PhD,7,In Progress,user research,Product Manager
"c++, system design, data structures","optimizing performance, backend logic",PhD,8,Certified,algorithm visualizer,Software Engineer
"api, react, html","ui design, backend systems, frontend development",Bachelor,1,Certified,portfolio website,Web Developer
"roadmapping, analytics, agile","business growth, leading teams, product strategy",PhD,3,None,product launch,Product Manager
"numpy, statistics, sql, pandas, deep learning","building models, ai research",Bachelor,2,In Progress,image classification,Data Scientist
"pandas, numpy, python, machine learning, sql","analyzing data, ai research, solving complex problems, building models",Self-Taught,7,In Progress,customer churn prediction,Data Scientist
"analytics, roadmapping, scrum, communication, agile","user experience, product strategy, business growth",Self-Taught,9,In Progress,product launch,Product Manager
"communication, scrum, agile","product strategy, user experience",Self-Taught,1,Certified,product launch,Product Manager
"figma, user research, prototyping","visual design, user interface",Bachelor,3,Certified,website redesign,UX Designer
"scrum, communication, agile, analytics, roadmapping","leading teams, user experience, product strategy",PhD,4,None,product launch,Product Manager
"numpy, sql, machine learning, deep learning, statistics, python, pandas","solving complex problems, analyzing data, ai research, building models",PhD,6,None,customer churn prediction,Data Scientist
"system design, algorithms, java, python, git, c++","backend logic, coding",Self-Taught,4,Certified,algorithm visualizer,Software Engineer
"adobe xd, wireframing, sketch","design capability, user testing, visual design, user interface",PhD,8,None,user flow diagram,UX Designer
"javascript, node.js, databases, react, api, html","frontend development, building websites, ui design",PhD,6,In Progress,e-commerce site,Web Developer
"c++, system design, python","coding, backend logic, optimizing performance, software architecture",PhD,8,None,desktop application,Software Engineer
"numpy, sql, deep learning, statistics, machine learning","ai research, analyzing data, building models",Self-Taught,5,Certified,sentiment analysis,Data Scientist
"adobe xd, prototyping, figma, user research","visual design, user interface, user testing",Self-Taught,9,In Progress,user flow diagram,UX Designer
"java, python, data structures, c++","coding, backend logic",PhD,4,In Progress,desktop application,Software Engineer
"prototyping, user research, wireframing, figma","design capability, visual design",Bachelor,1,In Progress,website redesign,UX Designer
"communication, scrum, roadmapping, analytics","product strategy, leading teams, business growth, user experience",Bachelor,3,In Progress,market analysis,Product Manager
"sql, numpy, deep learning, nlp, python, pandas, statistics","building models, ai research, analyzing data",Self-Taught,3,Certified,image classification,Data Scientist
"pandas, statistics, machine learning, sql, deep learning, nlp, python, numpy","solving complex problems, analyzing data",Self-Taught,7,Certified,customer churn prediction,Data Scientist
"pandas, numpy, sql, python","analyzing data, ai research, building models, solving complex problems",Bachelor,6,Certified,sentiment analysis,Data Scientist
"databases, css, html, javascript, api, node.js, react","ui design, frontend development, backend systems, building websites",Master,10,Certified,chat application,Web Developer
"user research, wireframing, sketch, adobe xd, figma, prototyping","design capability, user testing, visual design",Bachelor,4,Certified,website redesign,UX Designer
"api, node.js, html, css, databases, react, javascript","frontend development, backend systems",Bachelor,9,In Progress,portfolio website,Web Developer
"react, javascript, node.js, css","building websites, backend systems, frontend development, ui design",PhD,10,Certified,e-commerce site,Web Developer
"api, html, databases, node.js, react","ui design, backend systems, building websites, frontend development",Bachelor,5,None,chat application,Web Developer
"agile, roadmapping, market research, scrum","user experience, business growth, leading teams, product strategy",Bachelor,4,In Progress,market analysis,Product Manager
"sql, nlp, python, deep learning","building models, analyzing data",PhD,5,None,sentiment analysis,Data Scientist
"data structures, git, java","optimizing performance, backend logic",Bachelor,10,Certified,scalable system,Software Engineer
"wireframing, sketch, adobe xd, figma","user interface, user testing, design capability, visual design",PhD,2,Certified,user flow diagram,UX Designer
"java, python, data structures, c++, algorithms, system design","backend logic, coding, optimizing performance, software architecture",Self-Taught,10,Certified,desktop application,Software Engineer
"agile, scrum, market research","product strategy, business growth, leading teams",PhD,6,In Progress,market analysis,Product Manager
"node.js, databases, api, html","ui design, building websites, frontend development",PhD,10,In Progress,chat application,Web Developer
"nlp, statistics, pandas, numpy, sql","building models, ai research, analyzing data",Bachelor,8,Certified,image classification,Data Scientist
"node.js, react, databases, javascript","ui design, building websites, backend systems",PhD,2,In Progress,e-commerce site,Web Developer
"pandas, numpy, nlp, deep learning, statistics, sql, machine learning","ai research, building models",Self-Taught,7,None,sentiment analysis,Data Scientist
"javascript, react, node.js, databases, api","ui design, building websites, frontend development, backend systems",Master,9,In Progress,portfolio website,Web Developer
"user research, prototyping, sketch, figma, wireframing, adobe xd","user interface, visual design, design capability",PhD,6,None,mobile app design,UX Designer
"sql, machine learning, pandas, deep learning","solving complex problems, building models, analyzing data, ai research",Master,4,Certified,image classification,Data Scientist
"sketch, prototyping, user research, adobe xd, figma","user interface, visual design, design capability",PhD,4,None,website redesign,UX Designer
"sketch, prototyping, adobe xd, wireframing, user research","user testing, design capability, visual design",Master,1,In Progress,user flow diagram,UX Designer
"system design, java, git","optimizing performance, coding, backend logic",Bachelor,5,Certified,algorithm visualizer,Software Engineer
"market research, analytics, communication","leading teams, business growth, user experience, product strategy",Bachelor,4,None,user research,Product Manager
"html, css, react, api, databases, javascript, node.js","ui design, frontend development, backend systems",Master,0,None,portfolio website,Web Developer
"agile, roadmapping, market research, analytics","user experience, business growth",Master,4,None,user research,Product Manager
"data structures, algorithms, system design, java","optimizing performance, backend logic, coding",PhD,5,Certified,desktop application,Software Engineer
"market research, analytics, roadmapping, scrum, agile, communication","user experience, business growth, product strategy",Self-Taught,4,Certified,user research,Product Manager
"api, react, javascript, html, css, databases","ui design, building websites",Self-Taught,1,Certified,e-commerce site,Web Developer
"communication, agile, scrum","business growth, product strategy",Bachelor,3,In Progress,market analysis,Product Manager
"node.js, html, api, databases","building websites, backend systems",Master,8,None,e-commerce site,Web Developer
"market research, scrum, communication, roadmapping, agile","product strategy, business growth, user experience, leading teams",Master,4,In Progress,product launch,Product Manager
"system design, data structures, c++, algorithms, git","software architecture, optimizing performance, coding, backend logic",Bachelor,9,In Progress,algorithm visualizer,Software Engineer
"api, css, javascript, react","building websites, frontend development, backend systems",Master,3,In Progress,chat application,Web Developer
"agile, communication, scrum","business growth, product strategy",Bachelor,2,None,market analysis,Product Manager
"adobe xd, wireframing, sketch, user research","user interface, user testing, design capability, visual design",Self-Taught,2,In Progress,website redesign,UX Designer
"javascript, api, css, node.js","building websites, ui design, backend systems, frontend development",PhD,7,None,portfolio website,Web Developer
"roadmapping, market research, agile, scrum","user experience, product strategy, business growth, leading teams",Master,4,None,market analysis,Product Manager
"algorithms, c++, git, system design, python","backend logic, optimizing performance",Self-Taught,8,None,desktop application,Software Engineer
"sketch, user research, wireframing, figma, adobe xd, prototyping","visual design, user interface, design capability",Master,2,Certified,website redesign,UX Designer
"scrum, market research, analytics","user experience, business growth, leading teams",Self-Taught,1,In Progress,product launch,Product Manager
"javascript, html, node.js","backend systems, ui design",PhD,8,Certified,portfolio website,Web Developer
"git, system design, data structures, c++, java, python, algorithms","optimizing performance, backend logic, software architecture",Master,2,None,algorithm visualizer,Software Engineer
"html, react, javascript, databases, node.js, api","backend systems, ui design, building websites",Bachelor,3,None,e-commerce site,Web Developer
"databases, css, html, node.js, api","frontend development, ui design",Bachelor,7,In Progress,chat application,Web Developer
"deep learning, pandas, numpy, machine learning","solving complex problems, ai research, analyzing data",Master,7,In Progress,sentiment analysis,Data Scientist
"nlp, pandas, python","analyzing data, building models, solving complex problems",Self-Taught,1,None,image classification,Data Scientist
"c++, python, git, java, algorithms, system design, data structures","coding, optimizing performance, software architecture, backend logic",Self-Taught,4,Certified,algorithm visualizer,Software Engineer
"figma, wireframing, user research, adobe xd, prototyping","visual design, user interface, user testing",PhD,4,None,website redesign,UX Designer
"git, c++, algorithms, python, java, data structures","software architecture, coding",PhD,7,Certified,scalable system,Software Engineer
"sketch, wireframing, figma","user interface, user testing",PhD,3,In Progress,mobile app design,UX Designer
"roadmapping, agile, communication, market research, analytics","user experience, business growth",Bachelor,1,Certified,market analysis,Product Manager
"java, python, git, c++, system design","optimizing performance, coding, software architecture",Self-Taught,10,Certified,desktop application,Software Engineer
"user research, sketch, prototyping, adobe xd, wireframing, figma","visual design, user testing, user interface",Master,7,None,user flow diagram,UX Designer
"data structures, git, java","optimizing performance, software architecture, backend logic, coding",PhD,6,In Progress,algorithm visualizer,Software Engineer
"sql, machine learning, numpy, python, pandas, nlp","building models, ai research, analyzing data",Bachelor,6,In Progress,image classification,Data Scientist
"javascript, react, api, html, databases","ui design, backend systems, frontend development",Master,0,Certified,e-commerce site,Web Developer
"pandas, nlp, machine learning, python, sql, deep learning, numpy","building models, ai research",Bachelor,10,Certified,image classification,Data Scientist
"sql, python, pandas","solving complex problems, analyzing data, building models",Bachelor,10,None,sentiment analysis,Data Scientist
"api, css, react, javascript, html","backend systems, building websites, frontend development",Self-Taught,3,None,chat application,Web Developer
"user research, wireframing, figma, sketch, adobe xd","user interface, design capability, user testing, visual design",Bachelor,3,In Progress,user flow diagram,UX Designer
"node.js, react, javascript, databases","backend systems, building websites",Master,4,None,portfolio website,Web Developer
"node.js, css, databases, javascript","frontend development, backend systems, building websites",Master,0,Certified,e-commerce site,Web Developer
"git, system design, c++, data structures, algorithms","coding, backend logic, software architecture, optimizing performance",PhD,5,Certified,desktop application,Software Engineer
"wireframing, figma, adobe xd","user testing, design capability, visual design",Self-Taught,8,Certified,website redesign,UX Designer
"deep learning, statistics, python, numpy, machine learning, pandas, nlp","solving complex problems, analyzing data, ai research",Master,10,None,image classification,Data Scientist
"python, machine learning, statistics, pandas, deep learning","ai research, building models, analyzing data",Master,4,None,image classification,Data Scientist
"market research, agile, communication, scrum","product strategy, user experience",Master,3,None,product launch,Product Manager
"user research, prototyping, adobe xd","design capability, visual design, user testing",Bachelor,3,None,mobile app design,UX Designer
"api, html, react, javascript","frontend development, backend systems",Bachelor,5,Certified,chat application,Web Developer
"adobe xd, user research, prototyping, figma","user interface, design capability, visual design, user testing",Bachelor,2,Certified,website redesign,UX Designer
"deep learning, sql, nlp, pandas","ai research, analyzing data, solving complex problems",Self-Taught,4,Certified,sentiment analysis,Data Scientist
"system design, python, algorithms","optimizing performance, coding",Bachelor,9,None,algorithm visualizer,Software Engineer
"algorithms, system design, java, git, c++","optimizing performance, backend logic, coding",Bachelor,10,Certified,desktop application,Software Engineer
"css, html, api, node.js, databases, javascript, react","backend systems, ui design, building websites",PhD,7,Certified,chat application,Web Developer
"nlp, machine learning, pandas, numpy","solving complex problems, ai research",Bachelor,10,Certified,image classification,Data Scientist
"data structures, git, system design","backend logic, optimizing performance, coding",Master,1,None,desktop application,Software Engineer
"system design, algorithms, git, data structures","optimizing performance, backend logic",PhD,10,None,scalable system,Software Engineer
"databases, node.js, api, react, css, javascript","frontend development, backend systems",PhD,0,In Progress,portfolio website,Web Developer
"algorithms, python, java, git, data structures, c++","optimizing performance, backend logic, coding, software architecture",PhD,8,In Progress,algorithm visualizer,Software Engineer
"api, html, react, databases","ui design, backend systems, building websites, frontend development",Master,7,In Progress,e-commerce site,Web Developer
"git, java, c++, algorithms, data structures, system design","coding, optimizing performance, backend logic, software architecture",Bachelor,0,In Progress,algorithm visualizer,Software Engineer
"adobe xd, figma, prototyping, wireframing, user research","visual design, design capability, user interface, user testing",PhD,0,None,website redesign,UX Designer
"user research, wireframing, adobe xd, sketch","user interface, visual design, design capability, user testing",Master,7,In Progress,website redesign,UX Designer
"algorithms, java, git","optimizing performance, coding, backend logic",PhD,2,In Progress,algorithm visualizer,Software Engineer
"pandas, deep learning, nlp","analyzing data, building models",Bachelor,2,None,sentiment analysis,Data Scientist
"algorithms, java, c++, python, git, system design, data structures","backend logic, coding, optimizing performance",Master,4,In Progress,algorithm visualizer,Software Engineer
"prototyping, adobe xd, user research, figma, wireframing","visual design, user testing",Self-Taught,9,None,website redesign,UX Designer
"user research, wireframing, adobe xd, sketch, figma, prototyping","design capability, user testing, visual design",Self-Taught,7,In Progress,website redesign,UX Designer
"machine learning, deep learning, nlp","ai research, solving complex problems, building models, analyzing data",PhD,10,None,sentiment analysis,Data Scientist
"sketch, adobe xd, prototyping, figma","design capability, user testing, user interface, visual design",Master,9,Certified,mobile app design,UX Designer
"communication, market research, agile, scrum, analytics, roadmapping","product strategy, leading teams, user experience, business growth",Self-Taught,0,None,market analysis,Product Manager
"data structures, algorithms, c++, git, java","backend logic, optimizing performance, software architecture",Bachelor,10,None,scalable system,Software Engineer
"api, node.js, react","backend systems, frontend development",Master,3,None,e-commerce site,Web Developer
"java, data structures, git, algorithms, python, c++","software architecture, coding",Bachelor,10,Certified,desktop application,Software Engineer
"nlp, python, machine learning, sql","ai research, building models",Bachelor,6,In Progress,customer churn prediction,Data Scientist
"wireframing, figma, sketch, user research","design capability, user interface, user testing",Self-Taught,8,In Progress,user flow diagram,UX Designer
"machine learning, deep learning, pandas","ai research, solving complex problems, analyzing data, building models",Self-Taught,8,In Progress,sentiment analysis,Data Scientist
"javascript, react, html, node.js","ui design, building websites",PhD,2,In Progress,e-commerce site,Web Developer
"css, javascript, api, databases, node.js, react","backend systems, frontend development, ui design",Master,3,None,chat application,Web Developer
"analytics, scrum, market research","user experience, business growth",Master,7,None,user research,Product Manager
"api, react, html, javascript, databases, css, node.js","backend systems, building websites",Self-Taught,0,None,portfolio website,Web Developer
"roadmapping, scrum, agile, market research","leading teams, product strategy, user experience",Master,8,In Progress,market analysis,Product Manager
"roadmapping, communication, analytics, scrum","business growth, product strategy, leading teams, user experience",PhD,5,In Progress,user research,Product Manager
"sketch, prototyping, adobe xd, figma","design capability, visual design",Self-Taught,3,In Progress,website redesign,UX Designer
"user research, sketch, adobe xd","design capability, visual design",Master,0,None,website redesign,UX Designer
"user research, prototyping, figma, wireframing, adobe xd, sketch","user testing, design capability",Self-Taught,8,None,website redesign,UX Designer
"java, git, algorithms, data structures, system design, c++, python","coding, optimizing performance",PhD,6,None,algorithm visualizer,Software Engineer
"user research, figma, prototyping, wireframing, adobe xd","user testing, visual design, design capability, user interface",Self-Taught,3,None,user flow diagram,UX Designer
"machine learning, deep learning, numpy","building models, solving complex problems, ai research",Bachelor,5,In Progress,image classification,Data Scientist
"machine learning, sql, statistics","building models, solving complex problems, analyzing data, ai research",PhD,10,None,image classification,Data Scientist
"sketch, adobe xd, figma, user research, prototyping, wireframing","design capability, user testing, user interface",Self-Taught,9,In Progress,user flow diagram,UX Designer
"databases, react, css, javascript, api, node.js, html","backend systems, frontend development, building websites, ui design",Bachelor,1,Certified,e-commerce site,Web Developer
"statistics, sql, python, numpy, machine learning, nlp","ai research, building models, solving complex problems",Bachelor,1,Certified,image classification,Data Scientist
"pandas, nlp, numpy","solving complex problems, building models, ai research, analyzing data",Self-Taught,5,None,image classification,Data Scientist
"system design, git, algorithms, data structures, java","coding, optimizing performance, software architecture, backend logic",PhD,0,Certified,scalable system,Software Engineer
"analytics, agile, communication, market research, roadmapping","user experience, leading teams",Master,7,Certified,market analysis,Product Manager
"api, javascript, html, css","frontend development, building websites, ui design",Self-Taught,0,None,portfolio website,Web Developer
"sketch, adobe xd, prototyping","user testing, user interface",Bachelor,5,None,website redesign,UX Designer
"wireframing, adobe xd, figma","visual design, user interface, user testing, design capability",Bachelor,2,In Progress,mobile app design,UX Designer
"market research, analytics, scrum, communication, roadmapping","user experience, leading teams, product strategy",Bachelor,6,In Progress,user research,Product Manager
"figma, prototyping, sketch, wireframing, user research","design capability, user interface, user testing",Bachelor,7,None,mobile app design,UX Designer
"node.js, css, api, databases, react, html","building websites, backend systems",Master,9,Certified,e-commerce site,Web Developer
"html, databases, node.js, api, css, react, javascript","ui design, frontend development, backend systems, building websites",Master,10,In Progress,e-commerce site,Web Developer
"sql, nlp, machine learning, pandas, python","building models, ai research",Master,4,In Progress,image classification,Data Scientist
"scrum, agile, communication, market research","leading teams, product strategy, user experience, business growth",Self-Taught,5,None,product launch,Product Manager
"node.js, css, html, react","backend systems, ui design, building websites, frontend development",Bachelor,9,None,chat application,Web Developer
"numpy, sql, statistics, pandas, deep learning, machine learning, python","ai research, analyzing data",PhD,2,Certified,image classification,Data Scientist
"adobe xd, sketch, wireframing, user research","visual design, user interface, design capability, user testing",Bachelor,6,In Progress,user flow diagram,UX Designer
"analytics, agile, communication","user experience, business growth, product strategy",PhD,0,None,product launch,Product Manager
"c++, python, git, system design, java, algorithms","software architecture, optimizing performance, coding",PhD,10,In Progress,algorithm visualizer,Software Engineer
"system design, git, c++","coding, backend logic, software architecture",Master,9,In Progress,scalable system,Software Engineer
